{
  "schema_version": 1,
  "generated_at": "2026-08-10T15:15:52Z",
  "generator": "tools/explore/explore.sh",
  "git": {
    "head": "253820b7a0f718892a2c295219f4143395b761e1",
    "branch": "main",
    "dirty": 52,
    "uncommitted": 52
  },
  "components": [
    { "id": "00-foundation", "type": "directory", "relation": "FACT" },
    { "id": "agents", "type": "directory", "relation": "FACT" },
    { "id": "apps", "type": "directory", "relation": "FACT" },
    { "id": "architecture", "type": "directory", "relation": "FACT" },
    { "id": "ARCHITECTURE.md", "type": "directory", "relation": "FACT" },
    { "id": "archive", "type": "directory", "relation": "FACT" },
    { "id": "artifacts", "type": "directory", "relation": "FACT" },
    { "id": "audit", "type": "directory", "relation": "FACT" },
    { "id": "business", "type": "directory", "relation": "FACT" },
    { "id": "CHANGELOG.md", "type": "directory", "relation": "FACT" },
    { "id": "CODEOWNERS", "type": "directory", "relation": "FACT" },
    { "id": "config", "type": "directory", "relation": "FACT" },
    { "id": "contracts", "type": "directory", "relation": "FACT" },
    { "id": "CONTRIBUTING.md", "type": "directory", "relation": "FACT" },
    { "id": "data", "type": "directory", "relation": "FACT" },
    { "id": "decisions", "type": "directory", "relation": "FACT" },
    { "id": "deployment", "type": "directory", "relation": "FACT" },
    { "id": "DEPLOYMENT.md", "type": "directory", "relation": "FACT" },
    { "id": "development", "type": "directory", "relation": "FACT" },
    { "id": "docs", "type": "directory", "relation": "FACT" },
    { "id": "filesystem", "type": "directory", "relation": "FACT" },
    { "id": "generated", "type": "directory", "relation": "FACT" },
    { "id": "git", "type": "directory", "relation": "FACT" },
    { "id": ".gitattributes", "type": "directory", "relation": "FACT" },
    { "id": ".git-hooks", "type": "directory", "relation": "FACT" },
    { "id": ".github", "type": "directory", "relation": "FACT" },
    { "id": ".gitignore", "type": "directory", "relation": "FACT" },
    { "id": ".gitleaks.toml", "type": "directory", "relation": "FACT" },
    { "id": ".gitmessage", "type": "directory", "relation": "FACT" },
    { "id": "governance", "type": "directory", "relation": "FACT" },
    { "id": "kontekst.md", "type": "directory", "relation": "FACT" },
    { "id": "lib", "type": "directory", "relation": "FACT" },
    { "id": "LICENSE", "type": "directory", "relation": "FACT" },
    { "id": "mesh", "type": "directory", "relation": "FACT" },
    { "id": "MIGRATION.md", "type": "directory", "relation": "FACT" },
    { "id": "models", "type": "directory", "relation": "FACT" },
    { "id": "observability", "type": "directory", "relation": "FACT" },
    { "id": "operations", "type": "directory", "relation": "FACT" },
    { "id": "OWNERSHIP.md", "type": "directory", "relation": "FACT" },
    { "id": "README.md", "type": "directory", "relation": "FACT" },
    { "id": "RECOVERY.md", "type": "directory", "relation": "FACT" },
    { "id": "reference", "type": "directory", "relation": "FACT" },
    { "id": "resilience", "type": "directory", "relation": "FACT" },
    { "id": "secrets", "type": "directory", "relation": "FACT" },
    { "id": "security", "type": "directory", "relation": "FACT" },
    { "id": "SECURITY.md", "type": "directory", "relation": "FACT" },
    { "id": "shared", "type": "directory", "relation": "FACT" },
    { "id": ".skeleton.yaml", "type": "directory", "relation": "FACT" },
    { "id": "SOURCE-OF-TRUTH.md", "type": "directory", "relation": "FACT" },
    { "id": "STATE-FOUNDATION-B-REPORT.md", "type": "directory", "relation": "FACT" },
    { "id": "system", "type": "directory", "relation": "FACT" },
    { "id": "tests", "type": "directory", "relation": "FACT" },
    { "id": ".tools", "type": "directory", "relation": "FACT" },
    { "id": "tools", "type": "directory", "relation": "FACT" },
    { "id": "user", "type": "directory", "relation": "FACT" },
    { "id": "VERSION", "type": "directory", "relation": "FACT" }
  ],
  "pipelines": [
    { "id": "P-001", "family": "PRODUCT", "script": "product/discovery.sh", "class": "STANDARD", "status": "IMPLEMENTED", "depends": "", "contract": "DISCOVER,CONTRACT,EXECUTE,TEST,EVIDENCE,VERIFY,REGISTER,REPORT", "relation": "FACT" },
    { "id": "P-002", "family": "PRODUCT", "script": "product/requirements.sh", "class": "STANDARD", "status": "IMPLEMENTED", "depends": "P-001", "contract": "DISCOVER,CONTRACT,EXECUTE,TEST,EVIDENCE,VERIFY,REGISTER,REPORT", "relation": "FACT" },
    { "id": "P-003", "family": "PRODUCT", "script": "product/traceability.sh", "class": "STANDARD", "status": "IMPLEMENTED", "depends": "P-002", "contract": "DISCOVER,CONTRACT,EXECUTE,TEST,EVIDENCE,VERIFY,REGISTER,REPORT", "relation": "FACT" },
    { "id": "P-004", "family": "PRODUCT", "script": "product/prioritization.sh", "class": "FAST", "status": "IMPLEMENTED", "depends": "P-002", "contract": "DISCOVER,CONTRACT,EXECUTE,TEST,EVIDENCE,VERIFY,REGISTER,REPORT", "relation": "FACT" },
    { "id": "P-005", "family": "PRODUCT", "script": "product/roadmap.sh", "class": "STANDARD", "status": "IMPLEMENTED", "depends": "P-004", "contract": "DISCOVER,CONTRACT,EXECUTE,TEST,EVIDENCE,VERIFY,REGISTER,REPORT", "relation": "FACT" },
    { "id": "P-006", "family": "PRODUCT", "script": "product/backlog.sh", "class": "STANDARD", "status": "IMPLEMENTED", "depends": "P-005", "contract": "DISCOVER,CONTRACT,EXECUTE,TEST,EVIDENCE,VERIFY,REGISTER,REPORT", "relation": "FACT" },
    { "id": "P-007", "family": "PRODUCT", "script": "product/acceptance.sh", "class": "STANDARD", "status": "IMPLEMENTED", "depends": "P-003", "contract": "DISCOVER,CONTRACT,EXECUTE,TEST,EVIDENCE,VERIFY,REGISTER,REPORT", "relation": "FACT" },
    { "id": "P-008", "family": "DESIGN", "script": "design/architecture.sh", "class": "DEEP", "status": "IMPLEMENTED", "depends": "P-002", "contract": "DISCOVER,CONTRACT,EXECUTE,TEST,EVIDENCE,VERIFY,REGISTER,REPORT", "relation": "FACT" },
    { "id": "P-009", "family": "DESIGN", "script": "design/design-doc.sh", "class": "STANDARD", "status": "IMPLEMENTED", "depends": "P-008", "contract": "DISCOVER,CONTRACT,EXECUTE,TEST,EVIDENCE,VERIFY,REGISTER,REPORT", "relation": "FACT" },
    { "id": "P-010", "family": "DESIGN", "script": "design/contracts.sh", "class": "STANDARD", "status": "IMPLEMENTED", "depends": "P-009", "contract": "DISCOVER,CONTRACT,EXECUTE,TEST,EVIDENCE,VERIFY,REGISTER,REPORT", "relation": "FACT" },
    { "id": "P-011", "family": "DESIGN", "script": "design/interface.sh", "class": "STANDARD", "status": "IMPLEMENTED", "depends": "P-010", "contract": "DISCOVER,CONTRACT,EXECUTE,TEST,EVIDENCE,VERIFY,REGISTER,REPORT", "relation": "FACT" },
    { "id": "P-012", "family": "DESIGN", "script": "design/data-model.sh", "class": "DEEP", "status": "IMPLEMENTED", "depends": "P-010", "contract": "DISCOVER,CONTRACT,EXECUTE,TEST,EVIDENCE,VERIFY,REGISTER,REPORT", "relation": "FACT" },
    { "id": "P-013", "family": "DESIGN", "script": "design/tech-debt.sh", "class": "STANDARD", "status": "IMPLEMENTED", "depends": "P-008", "contract": "DISCOVER,CONTRACT,EXECUTE,TEST,EVIDENCE,VERIFY,REGISTER,REPORT", "relation": "FACT" },
    { "id": "P-014", "family": "DESIGN", "script": "design/change-impact.sh", "class": "DEEP", "status": "IMPLEMENTED", "depends": "P-003", "contract": "DISCOVER,CONTRACT,EXECUTE,TEST,EVIDENCE,VERIFY,REGISTER,REPORT", "relation": "FACT" },
    { "id": "P-015", "family": "SECURITY", "script": "security/threat-model.sh", "class": "DEEP", "status": "IMPLEMENTED", "depends": "P-008", "contract": "DISCOVER,CONTRACT,EXECUTE,TEST,EVIDENCE,VERIFY,REGISTER,REPORT", "relation": "FACT" },
    { "id": "P-016", "family": "SECURITY", "script": "security/secrets.sh", "class": "FAST", "status": "IMPLEMENTED", "depends": "", "contract": "DISCOVER,CONTRACT,EXECUTE,TEST,EVIDENCE,VERIFY,REGISTER,REPORT", "relation": "FACT" },
    { "id": "P-017", "family": "SECURITY", "script": "security/dependency-scan.sh", "class": "STANDARD", "status": "IMPLEMENTED", "depends": "P-016", "contract": "DISCOVER,CONTRACT,EXECUTE,TEST,EVIDENCE,VERIFY,REGISTER,REPORT", "relation": "FACT" },
    { "id": "P-018", "family": "SECURITY", "script": "security/static-analysis.sh", "class": "STANDARD", "status": "IMPLEMENTED", "depends": "P-017", "contract": "DISCOVER,CONTRACT,EXECUTE,TEST,EVIDENCE,VERIFY,REGISTER,REPORT", "relation": "FACT" },
    { "id": "P-019", "family": "SECURITY", "script": "security/penetration.sh", "class": "DEEP", "status": "IMPLEMENTED", "depends": "P-018", "contract": "DISCOVER,CONTRACT,EXECUTE,TEST,EVIDENCE,VERIFY,REGISTER,REPORT", "relation": "FACT" },
    { "id": "P-020", "family": "SECURITY", "script": "security/compliance.sh", "class": "RELEASE", "status": "IMPLEMENTED", "depends": "P-019", "contract": "DISCOVER,CONTRACT,EXECUTE,TEST,EVIDENCE,VERIFY,REGISTER,REPORT", "relation": "FACT" },
    { "id": "P-021", "family": "CODE", "script": "code/unit-tests.sh", "class": "FAST", "status": "IMPLEMENTED", "depends": "P-010", "contract": "DISCOVER,CONTRACT,EXECUTE,TEST,EVIDENCE,VERIFY,REGISTER,REPORT", "relation": "FACT" },
    { "id": "P-022", "family": "CODE", "script": "code/integration-tests.sh", "class": "STANDARD", "status": "IMPLEMENTED", "depends": "P-021", "contract": "DISCOVER,CONTRACT,EXECUTE,TEST,EVIDENCE,VERIFY,REGISTER,REPORT", "relation": "FACT" },
    { "id": "P-023", "family": "CODE", "script": "code/e2e-tests.sh", "class": "DEEP", "status": "IMPLEMENTED", "depends": "P-022", "contract": "DISCOVER,CONTRACT,EXECUTE,TEST,EVIDENCE,VERIFY,REGISTER,REPORT", "relation": "FACT" },
    { "id": "P-024", "family": "CODE", "script": "code/lint.sh", "class": "FAST", "status": "IMPLEMENTED", "depends": "", "contract": "DISCOVER,CONTRACT,EXECUTE,TEST,EVIDENCE,VERIFY,REGISTER,REPORT", "relation": "FACT" },